{
  "$schema": "../../../schemas/encounter-set.schema.json",
  "schemaVersion": "1.0.0",
  "code": "wh-hollow",
  "gameId": "wardens-hollow",
  "name": "The Hollow",
  "kind": "scenario",
  "summary": "The Warden's own encounter cards: hounds, mist, and the roots under the hill.",
  "cards": [
    { "code": "wh-120", "count": 3 },
    { "code": "wh-121", "count": 2 },
    { "code": "wh-130", "count": 3 },
    { "code": "wh-131", "count": 2 }
  ],
  "design": {
    "goals": [
      "Roughly even split between threat pressure and bodies",
      "One card that punishes upgrades, one that punishes wide tables"
    ],
    "notes": "10 cards is small on purpose: at 4 players the deck cycles about every 2.5 rounds, which makes reshuffle behaviour easy to observe."
  }
}
